<xs:schema version="1.0"
           xmlns:xs="http://www.w3.org/2001/XMLSchema"
           elementFormDefault="qualified">
    <xs:element name="contenedor">
        <xs:complexType>
            <xs:sequence>
                <xs:element name="portada" minOccurs="1" maxOccurs="1">
                    <xs:complexType>
                        <xs:sequence>
                            <xs:element name="imagen"  minOccurs="1" maxOccurs="1">
                                <xs:simpleType>
                                    <xs:restriction base="xs:string">
                                        <xs:pattern value="../[a-zA-Z]*/[a-zA-z]*/imagen[0-9]{1}.png"/>
                                    </xs:restriction>
                                </xs:simpleType>
                            </xs:element>
                            <xs:element name="altportada" minOccurs="1" maxOccurs="1">
                                <xs:simpleType>
                                    <xs:restriction base="xs:string">
                                        <xs:pattern value="[a-zA-Z]*"/>
                                    </xs:restriction>
                                </xs:simpleType>
                            </xs:element>
                            <xs:element name="titulo" minOccurs="1" maxOccurs="1">
                                <xs:simpleType>
                                    <xs:restriction base="xs:string">
                                        <xs:pattern value="Coche[a-zA-Z]{1}[0-9]{2}PVT"/>
                                    </xs:restriction>
                                </xs:simpleType>
                            </xs:element>
                        </xs:sequence>
                    </xs:complexType>
                </xs:element>
                <xs:element name="enlaces" maxOccurs="1">
                    <xs:complexType>
                        <xs:sequence>
                            <xs:element name="inicio" minOccurs="1" maxOccurs="1">
                                <xs:simpleType>
                                    <xs:restriction base="xs:string">
                                        <xs:enumeration value="Inicio"/>
                                    </xs:restriction>
                                </xs:simpleType>
                            </xs:element>
                            <xs:element name="Coches" minOccurs="1" maxOccurs="1">
                                <xs:simpleType>
                                    <xs:restriction base="xs:string">
                                        <xs:enumeration value="Productos"/>
                                        <xs:enumeration value="Coches"/>
                                        <xs:enumeration value="Autos"/>
                                        <xs:enumeration value="Vehiculos"/>
                                    </xs:restriction>
                                </xs:simpleType>
                            </xs:element>
                            <xs:element name="Soporte" minOccurs="1" maxOccurs="1">
                                <xs:simpleType>
                                    <xs:restriction base="xs:string">
                                        <xs:enumeration value="Soporte"/>
                                        <xs:enumeration value="Servicio"/>
                                    </xs:restriction>
                                </xs:simpleType>
                            </xs:element>
                            <xs:element name="Mas" minOccurs="1" maxOccurs="1">
                                <xs:simpleType>
                                    <xs:restriction base="xs:string">
                                        <xs:length value="3"/>
                                    </xs:restriction>
                                </xs:simpleType>
                            </xs:element>
                        </xs:sequence>
                    </xs:complexType>
                </xs:element>
                <xs:element name="central" minOccurs="1" maxOccurs="2">
                    <xs:complexType>
                        <xs:sequence>
                            <xs:element name="titulo"  type="xs:string"/>
                            <xs:element name="imagen" minOccurs="1" maxOccurs="1" >
                                <xs:simpleType>
                                    <xs:restriction base="xs:string">
                                        <xs:pattern value="../[a-zA-Z]*/[a-zA-z]*/imagen[0-9]{1}.png"/>
                                    </xs:restriction>
                                </xs:simpleType>
                            </xs:element>
                            <xs:element name="altcentral">
                                <xs:simpleType>
                                    <xs:restriction base="xs:string">
                                        <xs:pattern value="[a-zA-Z]*"/>
                                    </xs:restriction>
                                </xs:simpleType>
                            </xs:element>
                            <xs:element name="texto" type="xs:string" minOccurs="1" maxOccurs="1" />
                            <xs:element name="precio">
                                <xs:simpleType>
                                    <xs:restriction base="xs:decimal">
                                        <xs:totalDigits value="11"/>
                                        <xs:fractionDigits value="6"/>
                                    </xs:restriction>
                                </xs:simpleType>
                            </xs:element>
                        </xs:sequence>
                    </xs:complexType>
                </xs:element>
                <xs:element name="final" minOccurs="1" maxOccurs="1">
                    <xs:complexType>
                        <xs:sequence>
                            <xs:element name="masinfo"  minOccurs="1" maxOccurs="1">
                                <xs:complexType>
                                    <xs:sequence>
                                        <xs:element name="titulo" type="xs:string" maxOccurs="1"/>
                                        <xs:element name="imagen" minOccurs="1" maxOccurs="1">
                                            <xs:simpleType>
                                                <xs:restriction base="xs:string">
                                                    <xs:pattern value="../[a-zA-Z]*/[a-zA-z]*/imagen[0-9]{1}.png"/>
                                                </xs:restriction>
                                            </xs:simpleType>
                                        </xs:element>
                                        <xs:element name="altfinal" maxOccurs="1">
                                            <xs:simpleType>
                                                <xs:restriction base="xs:string">
                                                    <xs:pattern value="[a-zA-Z]*"/>
                                                </xs:restriction>
                                            </xs:simpleType>
                                        </xs:element>
                                        <xs:element name="texto" type="xs:string" maxOccurs="1"/>
                                        <xs:element name="contexto" type="xs:string" maxOccurs="1"/>
                                        <xs:element name="enlace" maxOccurs="1">
                                            <xs:simpleType>
                                                <xs:restriction base="xs:string">
                                                    <xs:enumeration value="Mas productos"/>
                                                </xs:restriction>
                                            </xs:simpleType>
                                        </xs:element>
                                        <xs:element name="telefono" maxOccurs="1">
                                            <xs:complexType>
                                                <xs:sequence>
                                                    <xs:element name="contexto" maxOccurs="1">
                                                        <xs:simpleType>
                                                            <xs:restriction base="xs:string">
                                                                <xs:enumeration value="Informacion de contacto"/>
                                                                <xs:enumeration value="Donde contactarnos"/>
                                                                <xs:enumeration value="Contactanos"/>
                                                            </xs:restriction>
                                                        </xs:simpleType>
                                                    </xs:element>
                                                    <xs:element name="numero" maxOccurs="1">
                                                        <xs:simpleType>
                                                            <xs:restriction base="xs:string">
                                                                <xs:length value="9"/>
                                                            </xs:restriction>
                                                        </xs:simpleType>
                                                    </xs:element>
                                                    <xs:element name="gmail" maxOccurs="2">
                                                        <xs:simpleType>
                                                            <xs:restriction base="xs:string">
                                                                <xs:pattern value="[a-zA-Z]{1,15}@[a-z]{1,25}[.][a-z]{2,4}"/>
                                                            </xs:restriction>
                                                        </xs:simpleType>
                                                    </xs:element>
                                                </xs:sequence>
                                            </xs:complexType>
                                        </xs:element>
                                    </xs:sequence>
                                </xs:complexType>
                            </xs:element>
                        </xs:sequence>
                    </xs:complexType>
                </xs:element>
            </xs:sequence>
        </xs:complexType>
    </xs:element>
</xs:schema>